{
  "id": "01M2519A4VN17APQPWS86FYERW",
  "title": "【极客湾】飘哥在线简单讲解A20Pro封装逻辑",
  "podcast_name": "极客Cut",
  "guests": null,
  "source_type": "youtube",
  "source_ref": "https://www.bilibili.com/video/BV1ZdYb6AE6p",
  "duration_seconds": 442,
  "language": "zh",
  "status": "processing",
  "stage_status": {
    "hook": "present",
    "three_act": "present",
    "chapters": "present",
    "entities": "present",
    "usefulness": "present",
    "tts": "missing"
  },
  "prompt_versions": {
    "one_liner": "v2",
    "three_act": "v4",
    "chapter_outline": "v3",
    "entity_extraction": "v1",
    "usefulness_score": "v1"
  },
  "summary_style": {
    "preset": "default",
    "note": null,
    "detail": "standard"
  },
  "hook": "飘哥用画图的方式,讲解 A20 Pro 如何借鉴电脑芯片的封装逻辑,把内存与芯片平面排布并加金属盖散热,从而提升瞬时高频发热的导热能力。他还顺带分析了它为何采用三通道 96 位 LPDDR5X 而非 LPDDR6,以及相比 A19 Pro 的 64 位内存,带宽直接提升 50%。",
  "three_act": {
    "background": "这期播客从传统手机芯片的 POP 封装讲起,解释芯片发热要层层向上传导、中间还夹着空气,散热路径很长。iPhone 的 A 系列虽然少了一层基板,但也好不了太多。",
    "core_argument": "这次 A19 Pro 换成了平面化封装,芯片和内存并排放在基板上,上面盖金属盖把两者罩住,整个相当于芯片级均热板,逻辑更像电脑芯片,类似 Lunar Lake 或 M1、M2。好处是短时瞬时高频发热时结温不会上那么快,散热能力明显更好。它用的是 96 位 LPDDR5X 三通道内存,不是小米玄戒那种方案;因为 LPDDR6 有校验位需要打折,所以它的实际带宽反而比同样 96 位的 LPDDR6 更大。相比其他手机 64 位 LPDDR5X,哪怕频率不变,带宽也直接提升 50%。",
    "conclusion": "speaker 因为这套封装和内存方案,对这颗芯片相当期待,认为它必须得好。明飞的现场上手没有连线,要直接等他的视频出来再说。"
  },
  "usefulness": {
    "score": 55,
    "band": "skimmable",
    "rationale": "飘哥用示意图讲解了A20 Pro从传统PoP封装改为类似PC的平面化封装加金属盖均热板、以及三通道96位LPDDR5X带宽提升50%这两个有用要点,但夹杂大量画图抱怨和闲聊,其余多为期待表态而无实证。"
  },
  "chapters": [
    {
      "idx": 0,
      "title": "传统手机芯片封装与iPhone的改进",
      "start_ms": 560,
      "end_ms": 235900,
      "key_points": [
        "传统手机芯片采用POP封装,芯片下方是基板,上方是内存,中间还有空气层,热量需要逐层向上传导。",
        "iPhone的A系列处理器去掉了芯片上方的一层基板,让内存几乎直接贴在芯片上,散热稍好一些,但改善有限。",
        "传统POP封装中,热量从芯片向上传递要经过多层结构,包括空气,导致散热效率较低。"
      ],
      "summary": "这部分解释了传统手机芯片的POP封装结构:芯片、基板、内存层层堆叠,热量传递路径长、散热差。iPhone通过去掉一层基板稍作改进,但整体仍不理想。",
      "quotes": [
        {
          "text": "这就是传说中的这个 POP 封装啊,这个就是传说中的 POP 封装。",
          "takeaway": "明确指出传统手机芯片的封装方式叫POP封装。",
          "start_ms": 80591
        },
        {
          "text": "iPhone 好一点,iPhone 呢上边呢,芯片上面呢,几乎就是内存,它这没有这个上面这一层基板,所以 iPhone 稍微好一点点,啊,但是也好不到哪里去。",
          "takeaway": "说明iPhone去掉了芯片和内存之间的基板,散热略有改善但依然有限。",
          "start_ms": 108589
        }
      ]
    },
    {
      "idx": 1,
      "title": "A19 Pro的新型封装结构:平面化与金属盖均热",
      "start_ms": 235900,
      "end_ms": 376682,
      "key_points": [
        "A19 Pro采用了全新的平面化封装结构,芯片和内存并排放在基板上,而不是垂直堆叠。",
        "这种新结构在芯片和内存上方覆盖了一个金属盖,整个金属盖相当于芯片级的均热板,能快速导出瞬时高频产生的热量。",
        "新封装类似电脑处理器如Lunar Lake或M1/M2的封装逻辑,不再是传统手机芯片的POP方式。",
        "由于热量能更快导出,结温不会迅速上升,尤其改善了短时瞬时高频的发热问题。",
        "相比三星的封装(金属盖只覆盖一半CPU),A19 Pro的金属盖完整覆盖内存和芯片,整体散热能力更强。"
      ],
      "summary": "A19 Pro改用平面化封装,芯片和内存并排,上方覆盖金属盖作为均热板,类似电脑处理器的散热设计,显著提升了瞬时高频下的散热能力。",
      "quotes": [
        {
          "text": "它盖了个金属盖,啊,然后整个把内存和芯片罩起来,然后这整个就相当于它的一个芯片级的均热板。",
          "takeaway": "描述A19 Pro的金属盖作为芯片级均热板,覆盖整个芯片和内存。",
          "start_ms": 235900
        },
        {
          "text": "它有点像电脑的芯片,像 Luna Lake 或者说像这个 M1 M2啊,它是电脑的这种逻辑,它不是原来手机的这种芯片的封装方式了。",
          "takeaway": "指出新封装借鉴了电脑处理器的设计逻辑,而非传统手机封装。",
          "start_ms": 253333
        }
      ]
    },
    {
      "idx": 2,
      "title": "96位LPDDR5X内存与带宽优势",
      "start_ms": 376682,
      "end_ms": 439810,
      "key_points": [
        "A19 Pro使用的是96位LPDDR5X内存,而其他手机如A19 Pro通常是64位LPDDR5X。",
        "因为LPDDR6有校验位需要打折,所以96位LPDDR5X的实际带宽比同样96位的LPDDR6更大,甚至比玄界O3还要大一点。",
        "采用三通道LPDDR5X,即使频率不变,带宽也比64位LPDDR5X直接提升50%。",
        "内存带宽提升对处理器性能有重要影响,这也是该芯片值得期待的原因之一。"
      ],
      "summary": "A19 Pro采用96位三通道LPDDR5X内存,由于LPDDR6有校验位导致实际带宽打折,因此96位LPDDR5X的带宽反而更大,比64位版本提升50%,这是该芯片备受期待的关键原因。",
      "quotes": [
        {
          "text": "哪怕频率不变,当然我相信频率肯定是变了,哪怕频率不变的情况下,这个带宽也是直接提升50%。",
          "takeaway": "说明从64位升级到96位,即使频率不变,带宽也直接提升50%。",
          "start_ms": 376682
        }
      ]
    }
  ],
  "entities": [
    {
      "name": "明飞",
      "kind": "person",
      "count": 1,
      "sample_timestamps_ms": [
        560
      ]
    },
    {
      "name": "A 系列处理器",
      "kind": "product",
      "count": 1,
      "sample_timestamps_ms": [
        560
      ]
    },
    {
      "name": "A19 Pro",
      "kind": "product",
      "count": 3,
      "sample_timestamps_ms": [
        560
      ]
    },
    {
      "name": "LPDDR5X",
      "kind": "product",
      "count": 2,
      "sample_timestamps_ms": [
        560
      ]
    },
    {
      "name": "LPDDR6",
      "kind": "product",
      "count": 3,
      "sample_timestamps_ms": [
        560
      ]
    },
    {
      "name": "Luna Lake",
      "kind": "product",
      "count": 1,
      "sample_timestamps_ms": [
        560
      ]
    },
    {
      "name": "M1 M2",
      "kind": "product",
      "count": 1,
      "sample_timestamps_ms": [
        560
      ]
    },
    {
      "name": "MC",
      "kind": "product",
      "count": 1,
      "sample_timestamps_ms": [
        560
      ]
    },
    {
      "name": "iPhone",
      "kind": "product",
      "count": 3,
      "sample_timestamps_ms": [
        560
      ]
    },
    {
      "name": "三星",
      "kind": "product",
      "count": 2,
      "sample_timestamps_ms": [
        560
      ]
    },
    {
      "name": "小米",
      "kind": "product",
      "count": 1,
      "sample_timestamps_ms": [
        560
      ]
    },
    {
      "name": "玄界 O3",
      "kind": "product",
      "count": 1,
      "sample_timestamps_ms": [
        560
      ]
    }
  ],
  "artifact_paths": {
    "markdown": "data/01M2519A4VN17APQPWS86FYERW/summary.md",
    "json": "data/01M2519A4VN17APQPWS86FYERW/summary.json",
    "tts": null
  },
  "created_at": "2026-09-10T06:50:09.863219",
  "updated_at": "2026-09-10T06:51:56.562781"
}