{
  "id": "01M2FKVC8GT40083QZHH6VRSMW",
  "title": "学历贬值、投资衰退：大学生该怎么面对这个衰退的时代？",
  "podcast_name": "降星驰",
  "guests": null,
  "source_type": "youtube",
  "source_ref": "https://www.bilibili.com/video/BV1wEY26pEbJ",
  "duration_seconds": 1742,
  "language": "zh",
  "status": "done",
  "stage_status": {
    "hook": "present",
    "three_act": "present",
    "chapters": "present",
    "entities": "present",
    "usefulness": "present",
    "tts": "missing"
  },
  "prompt_versions": {
    "one_liner": "v2",
    "three_act": "v4",
    "chapter_outline": "v3",
    "entity_extraction": "v1",
    "usefulness_score": "v1"
  },
  "summary_style": {
    "preset": "default",
    "note": null,
    "detail": "standard"
  },
  "hook": "这期播客剖析了当下大学生面临的残酷现实:出生率下降、AI冲击就业、学历迅速贬值、投资萎缩,传统“买房买车、阶级跃升”的内卷路径已经破灭。主播结合自身经验,讨论为什么读研不再划算、哪些行业还有增量,并给出“躺、润、拥抱不确定性”等应对策略,强调借助AI、尽早实习、持续维护简历、展示个人价值,才能在衰退时代找到生存与突围的机会。",
  "three_act": {
    "background": "这期播客针对身处衰退时代的大学生,讨论为什么传统的内卷路径已经失效。出生人口减少、AI冲击就业、投资萎缩、学历贬值等因素共同造成了前所未有的不确定性。",
    "core_argument": "内卷已不是选择,传统买房买车、阶级跃升的路径客观上破灭。唯一还有增量的方向是AI、出海及相关行业,努力必须与先进AI工具结合。保研和读研在多数情况下不再是可选项,因为三到七年后的岗位可能已被AI取代,早入行积累经验比待在学校更有利。大学真正有效的时间只有大一到大三,大四实际不存在,就业要提前实习,计算机尤其如此。技术本身在贬值,个人表达和拥抱市场的能力在升值。",
    "conclusion": "建议拥抱不确定性,时刻维护简历并在boss直聘上投递,把自己暴露在就业市场中,同时展示个人价值。小地方公务员和国企被看空,大城市公务员可作选项,润和躺平也是出路。读研仅适用于转专业、换赛道或升学历等少数情况,直博则取决于是否相信人类智能最终能胜过AI。"
  },
  "usefulness": {
    "score": 62,
    "band": "skimmable",
    "rationale": "主播以出生人口下降、AI冲击、学历扩招等具体背景支撑“衰退时代”论点,并给出实习、拥抱不确定性等建议,但缺乏新颖洞见且夹杂重复与闲聊,摘要即可获取核心要点。"
  },
  "chapters": [
    {
      "idx": 0,
      "title": "衰退时代的四个宏观特征:没人、AI冲击、行业增量集中、学历贬值",
      "start_ms": 930,
      "end_ms": 508064,
      "key_points": [
        "出生人口减少与现收现付养老金制度,在宏观上切断了年轻人的退路。",
        "AI 已对就业市场造成实质冲击,美团、腾讯、阿里在 AI 时代裁员裁得比较狠,但裁员本质是因为没有投资。",
        "中国经济增长三驾马车外贸、消费、投资中,投资现在集中在 AI 行业,因此想内卷基本只能从事 AI 或半导体等仍有增量的行业。",
        "日本90年代衰退期出海增长非常快,所以几乎所有人都在卷出海,说明衰退时代仍有局部增量。",
        "中国大学扩招约5年入学人数增长1.6到1.8倍,现在研究生一年毕业约200万到300万,就业市场很难消化。",
        "这个时代内卷已经不是选择,躺和润是可选道路,润包括出海,国内也建议润到大城市而不是小地方。"
      ],
      "summary": null,
      "quotes": [
        {
          "text": "如果你们在16年毕业,或者说15年毕业,对吧?大家大概率是会买房的。",
          "takeaway": "用15、16届毕业生的买房行为对比,说明增长预期已经消失。",
          "start_ms": 285928
        },
        {
          "text": "你要确定自己能够找到工作,对吧?你要明白整个就业市场它是怎样的一个风向。",
          "takeaway": "强调必须持续感知就业市场风向,而不是依赖过去的确定性。",
          "start_ms": 1310702
        }
      ]
    },
    {
      "idx": 1,
      "title": "AI 是唯一必须抓住的机会:先进工具、每月200元成本、替代老登",
      "start_ms": 508064,
      "end_ms": 625317,
      "key_points": [
        "如果大学生不愿意花钱买 AI、不愿意接触比较先进的 AI,现在就应该立刻退学。",
        "选择 AI 工具时,可以不用 GPT、Claude 这种级别,但至少不要用豆包这样的 AI,DeepSeek 在谷价期间非常便宜。",
        "每月最多花200块人民币左右,就可以接触到最先进的 AI 工具,带来学习和就业上的收益。",
        "AI 可以把工作中非常繁琐、偏门、你可能不知道怎么做的东西自动化,对专职程序员已经起到类似降维打击的作用。",
        "与老登比经验注定比不过,你能比的是跟 AI 的结合程度,看 AI 能给你多少自动化。",
        "学习怎么用 AI 有点像以前的人学习 Word、Excel,但 AI 给社会带来的影响比 Word、Excel 更加深远。"
      ],
      "summary": null,
      "quotes": [
        {
          "text": "如果在大学你不愿意花钱买 AI 你不愿意接触比较先进的 AI 对吧?你现在应该立刻退学。",
          "takeaway": "用极端说法强调大学生必须主动接触先进 AI 工具。",
          "start_ms": 508064
        },
        {
          "text": "你一个月最多也就花个那么200块人民币左右,你就可以接触到最先进的这些东西。",
          "takeaway": "给出接触先进 AI 的具体成本门槛:每月约200元人民币。",
          "start_ms": 559913
        }
      ]
    },
    {
      "idx": 2,
      "title": "大学真正的有效期只有大一到大三,实习要趁早",
      "start_ms": 625317,
      "end_ms": 768833,
      "key_points": [
        "大学实际上只有大一到大三这三年时间,大四是一个不存在的时间,因为保研在大三暑假、秋招在大三暑假、考研在12月左右。",
        "在大三一切尘埃落定之前必须努力,如果大三只花一年,根本卷不过其他人。",
        "就业方向建议在大二和大三期间就出去实习,实习越早越好。",
        "计算机就业的例子:要在大三找到实习,大三之前就要学就业相关知识,再之前还要学基础知识。",
        "保研、读研还要应付学校非常多的破事,可能一天要学6个小时,非常痛苦且没有办法。",
        "求学读书是一种投资,不要被老师以及十年前增长时代的人说的宏观东西骗了,那时候竞争人数和现在完全不同。"
      ],
      "summary": null,
      "quotes": [
        {
          "text": "大学啊是只有大一到大三这三年的时间的。",
          "takeaway": "给出大学有效期的明确判断:只有大一到大三三年。",
          "start_ms": 625317
        },
        {
          "text": "你至少在初三期间就要找到对应的实习。",
          "takeaway": "给出计算机就业路径的关键时间点:初三就要找到对应实习(原文如此表述)。",
          "start_ms": 711053
        }
      ]
    },
    {
      "idx": 3,
      "title": "不建议保研和读研:回报周期拉长、岗位可能消失、学历贬值叠加 AI 冲击",
      "start_ms": 768833,
      "end_ms": 1287489,
      "key_points": [
        "作者不建议保研和读研,因为处在衰退和不确定时代,读研就能找到更好工作的逻辑已经不成立。",
        "19年读研到22年毕业大概率找不到更好的工作,23年读研到26年毕业也大概率找不到更好的工作,因为 AI 出来了。",
        "比较读研和就业时不应拿本科生跟研究生比,而应该拿本科生加三年工作经验、提早三年入行来跟研究生比。",
        "计算机行业早入行、早点卷比待在象牙塔、产学分离的地方更好,在场内才能看到赛场风向,在场外可能以后根本进不了。",
        "纯粹的前端、纯粹的后端已经被 AI 冲击得几乎不见了,三年前只会前端也能找到不错的工作,现在难度完全不同。",
        "学位贬值、大扩招、就业萎靡、没有投资、AI 冲击共同造成三年前本科能进的岗位,三年后研究生毕业反而进不去。",
        "如果一定要读研只有几种情况:生物等不读研找不到工作、文科找不到工作、转专业换赛道、双非升985或985升北大软微;直博只适合全信人类智能最终大于 AI 的人。"
      ],
      "summary": null,
      "quotes": [
        {
          "text": "就是,即使是嗯计,从计算机的角这个领域的角度而言,你读研,你现就现在已经,就是在19年,如果你选择读研,那么你在22年,你大概率是找不到更好的工作的。",
          "takeaway": "用19年读研22年毕业的例子说明读研提升就业的逻辑已经失效。",
          "start_ms": 768833
        },
        {
          "text": "你三年前本科毫无经验的时候能进的岗位,那三年后你研究生毕业,对吧?你反而进不去了。",
          "takeaway": "点明学历贬值加上 AI 冲击导致研究生毕业反而竞争不过三年前本科。",
          "start_ms": 897946
        }
      ]
    },
    {
      "idx": 4,
      "title": "拥抱市场与不确定性:维护简历、在 boss 直聘投递、终身学习",
      "start_ms": 1287489,
      "end_ms": 1381359,
      "key_points": [
        "唯一建议是拥抱市场、拥抱不确定性;小地方公务员千万不要去,大城市的公务员可以作为一个选项。",
        "现在所有专业都需要终身学习,因为计算机过去十年带来的改变都不如 AI 近两年来带来的改变,计算机现在是以前快的五倍。",
        "会计、法律等行业也受冲击,法律现在可能都不知道怎么招实习生,因为事务性东西可以完全交给 AI 处理。",
        "拥抱不确定性的具体做法是时时刻刻把自己暴露在就业市场之中,哪怕大一新生也建议直接做一份简历。",
        "要时时刻刻维护一份有竞争力的简历,平时有空没空就去 boss 直聘上投递,确定自己能够找到工作并明白整个就业市场风向。"
      ],
      "summary": null,
      "quotes": [
        {
          "text": "你什么都不会,这不就是一个信号吗?兄弟。",
          "takeaway": "指出什么都不会本身就是需要立刻行动的明确信号。",
          "start_ms": 1287489
        },
        {
          "text": "维护一份有竞争力的简历,维护一份有用的简历,然后时时刻刻地在 boss 直聘上进行相关的这个投递。",
          "takeaway": "给出拥抱市场的可执行动作:持续维护简历并在 boss 直聘投递。",
          "start_ms": 1300875
        }
      ]
    },
    {
      "idx": 5,
      "title": "不做培训班式内卷:大一学基础、大二学技术、大三实习;就业市场从技术转向个人展示",
      "start_ms": 1381359,
      "end_ms": 1675338,
      "key_points": [
        "不建议大学一进来就学培训班的东西,培训班已经死掉了,因为就业市场变化太快,培训班赶不上这个速度。",
        "大一学的东西比如前后端开发,到大四可能都不存在这样的职业;建议大一学更基础、更普适性的东西,比如编程语言、数据结构、操作系统、计算机网络。",
        "建议大二开始学技术,大三出去实习,把基础功学完,从第一性原理去分析事情;现在有了 AI,掌握一个东西的第一性原理非常非常简单。",
        "就业市场风向从技术角度偏向个人角度,过去招人看你简历上的技术栈,现在更偏向个人,因此要更加展示自己。",
        "展示自己的渠道可以是哔哩哔哩、小红书、vlog,总归要有一个可以展示自己的地方。",
        "以前复刻 GitHub 项目要花非常大的时间和精力,现在只需要跟 GPT 说帮我看一下这个项目、能不能自己复刻一个,ChatGPT 就能非常简单帮你复刻出来,AI 让每个人生产力飞跃可能是5倍可能是10倍。"
      ],
      "summary": null,
      "quotes": [
        {
          "text": "培训班已经他妈的死掉了,为什么?因为就业市场变得太快了,培训班都赶不上这么快的速度。",
          "takeaway": "给出不做培训班式内卷的理由:就业市场变化速度已超过培训班更新速度。",
          "start_ms": 1381359
        }
      ]
    },
    {
      "idx": 6,
      "title": "AI 是呼啸而过的火车,错误会指数级滚雪球,唯一要做的是扒上火车",
      "start_ms": 1675338,
      "end_ms": 1741420,
      "key_points": [
        "AI 对绝大部分人是危机,但危机之间存在机遇,对个人而言还是有一些增长的空间。",
        "面试官在技术差不多的情况下,会更倾向于选非常热情、阳光、积极表达自己想做的东西的人,而不是只有技术的就业者。",
        "具体技术在变得廉价,但技术本身在变得昂贵,因为现在有以前十倍的产量,也能犯出以前十倍的错误,而错误会滚雪球、指数级增长。",
        "AI 像从远处驶来的火车,在远处时你觉得它离自己遥远,但 AI 前进速度比人类快得多,某一时刻会跟你擦肩而过,一旦跑到你面前就再也追不上了。",
        "数学领域最近一年发生的事情:从人类跟 AI 协作能做出非常不错的成果,到现在人类跟 AI 协作似乎并不需要人类了,只发生在一年内。",
        "在这个时代唯一要做的事情就是扒上 AI 这列火车,成为 OpenAI 最锐利的剑、安索洛夫最锐利的眼、AI 大人的引路人,狠狠压力老登,淘汰旧时代的生产力。"
      ],
      "summary": null,
      "quotes": [
        {
          "text": "AI 一旦跑到你的面前,就再也追不上了。",
          "takeaway": "用火车比喻强调错过 AI 的窗口期后无法追赶。",
          "start_ms": 1675338
        },
        {
          "text": "你唯一要做的事情。就是扒上这个火车,啊成为 OpenAI 最锐利的剑,安索洛夫最锐利的眼,成为 AI 大人的引路人。",
          "takeaway": "给出面对 AI 时代唯一行动号召:主动扒上 AI 这列火车。",
          "start_ms": 1715495
        }
      ]
    }
  ],
  "entities": [
    {
      "name": "ChatGPT",
      "kind": "product",
      "count": 3,
      "sample_timestamps_ms": [
        930
      ]
    },
    {
      "name": "Deepseek",
      "kind": "product",
      "count": 1,
      "sample_timestamps_ms": [
        930
      ]
    },
    {
      "name": "Excel",
      "kind": "product",
      "count": 2,
      "sample_timestamps_ms": [
        930
      ]
    },
    {
      "name": "GPT",
      "kind": "product",
      "count": 9,
      "sample_timestamps_ms": [
        930
      ]
    },
    {
      "name": "GitHub",
      "kind": "product",
      "count": 2,
      "sample_timestamps_ms": [
        930
      ]
    },
    {
      "name": "OpenAI",
      "kind": "product",
      "count": 1,
      "sample_timestamps_ms": [
        930
      ]
    },
    {
      "name": "Word",
      "kind": "product",
      "count": 2,
      "sample_timestamps_ms": [
        930
      ]
    },
    {
      "name": "哔哩哔哩",
      "kind": "product",
      "count": 2,
      "sample_timestamps_ms": [
        930
      ]
    },
    {
      "name": "小红书",
      "kind": "product",
      "count": 1,
      "sample_timestamps_ms": [
        930
      ]
    },
    {
      "name": "牛客网",
      "kind": "product",
      "count": 1,
      "sample_timestamps_ms": [
        930
      ]
    },
    {
      "name": "美团",
      "kind": "product",
      "count": 1,
      "sample_timestamps_ms": [
        930
      ]
    },
    {
      "name": "腾讯",
      "kind": "product",
      "count": 1,
      "sample_timestamps_ms": [
        930
      ]
    },
    {
      "name": "豆包",
      "kind": "product",
      "count": 1,
      "sample_timestamps_ms": [
        930
      ]
    },
    {
      "name": "阿里",
      "kind": "product",
      "count": 2,
      "sample_timestamps_ms": [
        930
      ]
    }
  ],
  "artifact_paths": {
    "markdown": "data/01M2FKVC8GT40083QZHH6VRSMW/summary.md",
    "json": "data/01M2FKVC8GT40083QZHH6VRSMW/summary.json",
    "tts": null
  },
  "created_at": "2026-09-14T09:27:15.770252",
  "updated_at": "2026-09-14T09:32:55.984360"
}